postNumber,subject,date,time,title,subtitle,picture,content
1,computers,2022-12-12,9:28,Simulated Annealing,Annealing? Annealing metal?,https://www.win-therm.com.my/wp-content/uploads/2021/02/annealing-metal-01.jpeg,"When you increase the temperature of a material, its molecules can freely move and get new positions. Then, when it cools down slowly, molecules positions are stabilized and the material can tolerate more pressure. It's due to the fact that the molecules have better formation. A researcher asked themselves, can we use this characteristic in solving hard problems? And after a while, they found the answer and the answer was a big YES. So, the basic idea is that, in the early stages of searching the solutions space, we may accept a bad solution instead of a good one that we found, and explore around the bad one. As we get to the final stages of our search, the probability of choosing bad solutions gets lower and we get more eager to explore around the good solutions we find. That's the idea, and then they implemented it in several languages and named it 'Simulated Annealing'. I have recently tried to implement the algorithm in MATLAB (I know, but I had to :\) to solve TSP problems. Take a look and enjoy. <a href='https://github.com/abolhoseinisina/GIS-Tools/tree/main/Computational%20Intelligence/TSP/Simulated%20Annealing'>Link</a> <br> Also, take a look at this video for better understanding: <br> <iframe width='100%' height='300' src='https://www.youtube.com/embed/iaq_Fpr4KZc' title='YouTube video player' frameborder='0' allow='accelerometer; autoplay; clipboard-write; encrypted-media; gyroscope; picture-in-picture' allowfullscreen></iframe>"
2,science,2022-12-13,1:00,Geopolitics,America,https://upload.wikimedia.org/wikipedia/commons/e/ec/%D0%A5%D0%B0%D1%80%D1%82%D0%BB%D0%B5%D0%BD%D0%B4_%D0%B8_%D0%A0%D0%B8%D0%BC%D0%BB%D0%B5%D0%BD%D0%B4.jpg,"Geopolitics is learning how Geography can affect politics and international relations. The geographical attributes may be area, topography, demography, climate, natural resources or even applied science. Alfred Thayer Mahan (1840-1914) believed a country that has commercial and military control over the sea is powerful. That's why gaining control over choke points, canals, and coaling stations is very important. Mahan counted six conditions to have sea power: <ul><li>Advantageous geographical position</li><li>Serviceable coastlines, abundant natural resources, and favorable climate</li><li>Extent of territory</li><li>Population large enough to defend its territory</li><li>Government with the influence and inclination to dominate the sea</li></ul> Mahan believed that in central Asia there are still independent countries that survived, such as Turkey, Persia, Afghanistan, China, and Japan. <br /> Nicholas J. Spykman believed that resources and population of Eurasia are far more than America. This can be extremely dangerous for America if one power rules one of the spheres of Europe or Asia. So America must seek a balance between powers in Eurasia. The beginning of the Cold War had two aspects, first, moral opposition to Communism and second, the geopolitical task of containing Soviet expansion, Kissinger said. America was the winner of the Cold War because it was for the first time that a non-Eurasian power balanced the powers in it.  <br />Why not watch this movie to get a better insight with maps? <iframe width='100%' height='300' src='https://www.youtube.com/embed/zZJFozFsnIU' title='YouTube video player' frameborder='0' allow='accelerometer; autoplay; clipboard-write; encrypted-media; gyroscope; picture-in-picture' allowfullscreen></iframe>"
3,science,2022-12-14,0:20,Geopolitics,China,https://images.squarespace-cdn.com/content/v1/56a146abb204d5878d6f125a/1603467046026-UID0GYJ52XFAD2HFEZY0/Egress+routes+from+China%E2%80%99s+littoral+waters.png,"China is after sea power in the South  China Sea. That's why Taiwan is absolutely important to China. After stabilizing its economy, China wants to play a more important role in global affairs. China initiated the One Belt One Road project to achieve this objective. By having access to the ocean, having better access to Central and West Asia can increase its power exponentially. <br><div class='image-container w3-center'><img src='https://imageio.forbes.com/blogs-images/stratfor/files/2017/10/q3-asia-belt-and-road-main-map-obor-white-1-1200x1207.jpg?height=715&width=711&fit=bounds' width='100%'><div class='image-overlay'>Reference: https://imageio.forbes.com</div><br></div>The communism idealogy seems to be not blaring the vision of politicians in China. They are collaborating with liberal countries to move toward their goals. The Belt Road Initiative is an ambitious project to achieve oil and gas in the Middle East. It should be noted that China has also created the Asian Infrastructure Investment Bank to compete with the World Bank. Currently, Cybersecurity and Social Media apps play important roles in the relation between China and the U.S. and tension between them may arise based on these two issues. There have been large censorships in China towards U.S. Social Media apps. Until now, China has challenged none of Russian interests in Central Asia. Take a look at the following video to get more details about Belt Road Initiative: <br /><iframe width='100%' height='300' src='https://www.youtube.com/embed/j8zzL2aBo2M' title='YouTube video player' frameborder='0' allow='accelerometer; autoplay; clipboard-write; encrypted-media; gyroscope; picture-in-picture' allowfullscreen></iframe>"
4,science,2022-12-15,1:20,Geopolitics,Canada,https://chalkboardpublishing.com/wp-content/uploads/2020/10/shield.jpg,"I have recently moved to Canada. Somehow I found it very interesting how the geography shaped the Canada population, economic and policies. There are two major geographical features in Canada, The Canadian Shield and the Rocky mountains range. The first one shaped the population growth in Ontario, Quebec and Manitoba. There is no possibility for agricultural or infrastrutural growth in the sheild region. So, it has stayed inhabitable. It also created a gap between the Ontario and eastern provinces and the praries (which consists of Alberta, Saskatchuan and Manitoba). This gap has bring differences in culture, infrastructure, population and also other features of the society. There is also the Rocky mountain range in the west of praries. This high altitude mountain, has made a barrier between other parts of the Canada and the British Columbia province. It's fascinating how Canada stayed unified during all these years with these gaps in between the country. The praries region has more connection with the Canada's southern neighbor because there is no barrier in the southern parts of Canada. Most of the population has been concentrated in the east coast. so, there is a lack of good transportation infrastructure between eastern regions and the rest of Canada. The government has to disperse the population toward the central regions and concentrate to provide better transportation infrastruture. Because of the global warming there is going to be a new wave of immigrations because of the weather, and the current peaceful situtation may not stay the samI have recently moved to Canada. Somehow, I find it very interesting how the geography shaped the Canadian population, economy and policies. There are two major geographical features in Canada; The Canadian Shield and the Rocky mountains range. <br />The first one shaped the population growth in Ontario, Quebec and Manitoba. There is no possibility for agricultural or infrastructure growth in the shield region. So, it has stayed inhabitable. It also created a gap between the Ontario and eastern provinces and the prairies (which consists of Alberta, Saskatchuan and Manitoba). This gap has brought differences in culture, infrastructure, population and also other features of society. There is also the Rocky mountain range in the west of the prairies. This high altitude mountain has made a barrier between other parts of Canada and the British Columbia province. It's fascinating how Canada stayed unified during all these years with these gaps in between the country. The prairies region has more connections with Canada's southern neighbor because there is no barrier in the southern parts of Canada. Most of the population has been concentrated on the east coast. So, there is a lack of good transportation infrastructure between the eastern regions and the rest of Canada. The government has to disperse the population toward the central regions and concentrate on providing better transportation infrastructure. Because of global warming, there is going to be a new wave of immigration because of the weather, and the current peaceful situation may not stay the same for Canada as there may be some issues with separating apart different parts of Canada. <br />Let's take a better view of Canada geography: <iframe width='100%' height='300' src='https://www.youtube.com/embed/TftLaHb1FvA' title='YouTube video player' frameborder='0' allow='accelerometer; autoplay; clipboard-write; encrypted-media; gyroscope; picture-in-picture' allowfullscreen></iframe>"
5,science,2022-12-16,20:00,Geopolitics,Germany,https://pbs.twimg.com/media/DeW2wFwX4AEJjuS?format=jpg&name=4096x4096,"Ratzel (1844-1904) stated that states are organic, growing and dynamic, based on the influence he got from Darwin. He concluded that static states are in decline. He was also agreed that sea power is needed because of its advantages. After Ratzek, several scientists expanded his theories and there were used in the propaganda of Nazi Germany. After this, German geopolitic was discredited.<br /> Germany is located in the center of Europe with 7 navigable rivers. South of Germany is the Alpe mountains and north of it is the Baltic Sear. The rivers provide cheap tranpsrotation of goods and materials along their path and that's one of the main reasons Germany is the 3rd exporter in the World. This has brung with itself wealth for Germany government. The power in Germany is decentralized over the country. This is how Germany has been keeping its unity. But the wealth is not dispersed evenly, specially between west and east of the country, maybe due to their past. but 100% due to the rivers layout.<br />South of Germany is geographically have advantages, but north of it is a flat land that can be envaded from every direction. That's where EU and NATO come t help Germany with its borders in east and west, respectively.<br />Let's look at the map: <iframe width='100%' height='300' src='https://www.youtube.com/embed/oTPIzzcBPaA' title='YouTube video player' frameborder='0' allow='accelerometer; autoplay; clipboard-write; encrypted-media; gyroscope; picture-in-picture' allowfullscreen></iframe>"
6,science,2022-12-17,21:00,Geopolitics,United Kingdom,https://www.worldatlas.com/r/w1200/upload/92/d7/ad/united-kingdom-map-and-flag.png,"The UK has been one of the key players of the world that shaped it. It consists of 4 parts; England, Scotland, Northern Ireland and Wales and they have been unified for 300 years. After England, Scotland is one of the most important members of the UK. The main objective of the UK is to maintain its access to the sea and also its sea power. So, they have been in a close relationship with the U.S. They have participated in several conflicts in support of the U.S. (29 conflicts in all continents). Currently, they act as a bridge between the U.S. and Europe. The U.K. must make sure that a power or unity does not occur in Europe. Because whenever there was a power in Europe, they invaded the U.K. and it became very vulnerable.<br><div class='image-container w3-center'><img src='https://preview.redd.it/oad67qhq5y561.jpg?width=640&crop=smart&auto=webp&s=1d2d3b63c086cf99e62b8bb0fdffc0bd5ec6c10b' width='300'><div class='image-overlay'>Reference: https://preview.redd.it</div><br></div>After the Brexit, U.K. managed to recover quickly with the help of the U.S. But now they have made issues with the Scotland and Northern Ireland. During the Brexit negotiations, the majority of Scotland and Northern Ireland people were in favor of staying in the EU zone. But, the government in London finally decided to exit from the EU. Although there have always been talks about independence in Scotland and Northern Ireland, but after Brexit, it seems like they are getting more serious. The COVID outbreak helped London with the impossibility of a new referendum in Scotland and Ireland. But after recovering from it, it seems like the U.K. has to act faster in order to prevent breaking into parts. <br />Let's take a look at the following video: <iframe width='100%' height='300' src='https://www.youtube.com/embed/odBWNUq9k2s' title='YouTube video player' frameborder='0' allow='accelerometer; autoplay; clipboard-write; encrypted-media; gyroscope; picture-in-picture' allowfullscreen></iframe>"
7,computers,2022-12-21,12:17,Kernels,Machine Learning Classification,https://imageio.forbes.com/specials-images/dam/imageserve/966248982/960x0.jpg,"Sometimes in a classification problem, features are tie to each other and have a non-linear relationship. In such situations, we can create additional features from the original ones in a way that they can be separated linearly. Suppose that we have the following features and classes:<br><br><br><div class='image-container w3-center'><img src='https://www.jeremyjordan.me/content/images/2017/06/data_2d_to_3d_hyperplane.png' width='100%'><div class='image-overlay'>Reference: https://www.jeremyjordan.me</div><br></div>As it can be seen in the right picture, they cannot be separated linearly. So, we add another feature based on the first two that can be separated linearly. This approach is called the&nbsp;<b>Kernel trick</b>. There are common kernel functions that can be used:</div><div><ul><li><a href='https://www.geeksforgeeks.org/creating-linear-kernel-svm-in-python/' target='_blank'>Linear</a><br></li><li><a href='https://en.wikipedia.org/wiki/Polynomial_kernel#:~:text=In%20machine%20learning%2C%20the%20polynomial,learning%20of%20non%2Dlinear%20models.' target='_blank'>Polynomial</a>&nbsp;</li><li><a href='https://en.wikipedia.org/wiki/Radial_basis_function_kernel' target='_blank'>Radial Basis Function</a><br></li><li><a href='https://oneapi-src.github.io/oneDAL/onedal/algorithms/kernel-functions/sigmoid-kernel.html' target='_blank'>Sigmoid</a><br></li></ul></div>"
8,science,2022-12-23,19:19,Geopolitics,Iran,https://today.emerson.edu/wp-content/uploads/2022/09/iranmap.jpg,"I am an Iranian and it is very interesting to me how the geography dictates things to policy of countries. Iran is a <b>fortress</b>. Borders of Iran are limited to the mountain ranges surrounding it in West, East and North and the Persian Gulf limiting it from the South. Iran has been known for its oil. Although it should be a wealthy country, it has a very low GDP. The main problem of Iran is its mountains. Iran needs plain for its population and I think that's why Iran invested so much in Iraqi Shia groups.<br><div class='image-container w3-center'><img src='https://i.pinimg.com/736x/35/92/c8/3592c80552735bfce7c96fdb524f00dd.jpg' width='100%'><div class='image-overlay'>Reference: https://i.pinimg.com</div></div><br>The mountainous nature of Iran, also made it impossible to unify the country culturally. With mountains, creating transportation infrastructure becomes difficult. With poor infrastructure comes cultural, economical, religion and etc. differences. That's why Iran is the house of different ethnic groups. Ethnic groups can historically become a tool for superpowers to intervene in a country affairs. Currently, the U.S. has stablished several bases around Iran and tried to support&nbsp;separatist movements in&nbsp;Balochistan, Khuzestan, and Kurdistan.<br><div class='image-container w3-center'><img src='https://upload.wikimedia.org/wikipedia/commons/f/f6/The_ethnic_composition_of_Iran.png.jpg' width='100%'><div class='image-overlay'>Reference: https://upload.wikimedia.org</div></div><br>Iran is located in the Middle East, and this part of the World has always been in wars, conflicts, revolutions and so on. Iran has always used neighbor countries as proxies for its conflicts with others. Currently, Iran and Saudi Arabia are in conflict in Yemen, Iraq, Syria, and Libya. That's just like the conflicts the U.S. and the Soviet Union had between 1947 and 1991. Iran and Saudi Arabia are fighting for control over the Middle East. Super powers like U.S., British Empire and Russia have always intervened in Iran affair. Even, the U.S. performed a coup in 1953, against Mossadegh and killed the possibility of a democracy in Iran. After the Islamic revolution of Iran in 1972, Iran tried to get more control over the Middle East countries. After Iraq invasion to Iran, the Saudi Arabia supported Iraq. Iraq was acting as a buffer between Iran and Saudi Arabia until the U.S. invaded Iraq and ruined that buffer. Iran supported armed Shia groups in Iraq and Saudi Arabia supported armed Sunni groups. The same thing happened in Tunisia, Bahrain, Libya, Lebanon, Yemen, and even Morocco.<br>Beside all the things I mentioned above, Saudi Arabia has a good relationship with the World superpower, the U.S. U.S. supports&nbsp;the Saudi Arabia with warfare, maritime security and most importantly, with media. On the other hand, Iran sticks with the Russia which is in constant struggle. Saudi Arabia has recently used media to aggressively increase the tension between ethnic groups in Iran and support separatist movements.<br>Iranian government is doing the following actions to control the country:<br><ul><li>Establishing a repressive security capability to control the ethnic and religious tensions inside</li><li>Manipulate ethnic and religious tensions in Iraq and Afghanistan</li><li>Move to create a nuclear force</li></ul> <br>Let's look at this video for more details:<br><iframe width='100%' height='300' src='https://www.youtube.com/embed/XjA_wSBzS00' title='YouTube video player' frameborder='0' allow='accelerometer; autoplay; clipboard-write; encrypted-media; gyroscope; picture-in-picture' allowfullscreen></iframe>"
9,technology,2022-12-25,1:03,Linear Referencing System,Geospatial Systems,https://gisgeography.com/wp-content/uploads/2020/11/Linear-Referencing-Road-Network-550x427.png,"Suppose that an accident happens on a highway and you call the Police for help. The police office asks you about the location of the accident. But you are unaware of the coordinates. Another way to answer this question, is to tell the officer what the name of the highway is and how much you drove from a specific city toward which direction. For example, you can tell them, I drove 20 miles to the west of Winnipeg on Highway 1. This description lets the officers know your exact location. This is the basis of Linear Referencing Systems.<div>Linear referencing is the method to store and geographically locate data using relative positions along a measured line feature without the need to explicitly use x, y coordinates or an address (<a href='https://pro.arcgis.com/en/pro-app/latest/help/data/linear-referencing/introduction-to-linear-referencing.htm' target='_blank'>ESRI</a>). We can define a point or part of a line along a linear feature in this referencing system. LRSs can be generated for different tasks along a same linear feature. For example, an LRS can be generated to manage accidents along a street, and another one can be generated to manage underground pipelines along the street. Then different LRSs can be superimposed to get a multilayer map of the street. My current research is related to generating an LRS for managing traffic volume data.&nbsp;</div><div>The following video explains the LRSs currently used in Winnipeg, MB, CA:</div><div><iframe width='100%' height='300' src='https://www.youtube.com/embed/s-MoXGuoMfc' title='YouTube video player' frameborder='0' allow='accelerometer; autoplay; clipboard-write; encrypted-media; gyroscope; picture-in-picture' allowfullscreen></iframe><br></div>"
10,science,2022-12-25,22:07,Geopolitics,Saudi Arabia,https://pbs.twimg.com/media/EXf3AprWsAAiedr?format=jpg&name=4096x4096,"Saudi Arabia is surrounded by deserts from the North, East, and South, and the Red Sea from the West. This country is known for its oil. There are large reservoirs of oil just on its borders with the Persian Gulf and under the Rub' Al Khali desert. The reservoirs under the desert are not currently profitable because the oil price is low and it costs a lot to extract them from the desert. The reservoirs near the Persian Gulf are the main source of income for Saudi Arabia. The problem is, the people in that region of the country are mostly Shia Muslims, and Saudi Arabia considers them as second-class citizens. Because their beliefs are in contrast with Wahhabi Muslims. One geopolitical issue with Saudi Arabia is that other countries can manipulate the population in the East regions of Saudi Arabia and endanger the Arabian source of income.&nbsp;<div><br><div class='image-container w3-center'><img src='https://upload.wikimedia.org/wikipedia/commons/thumb/8/83/Oil_and_Gas_Infrastructure_Persian_Gulf_%28large%29.gif/681px-Oil_and_Gas_Infrastructure_Persian_Gulf_%28large%29.gif' width='80%'><div class='image-overlay'>Reference: https://upload.wikimedia.org</div><br></div><div>The west regions of Saudi Arabia are more hospitable due to mountain ranges near the Red Sea. A large portion of the country's population lives in this region. This region has a border with Yemen. People who live in Yemen near the border with Saudi Arabia are mostly Shia Muslims and Iran has caused issues for Saudi Arabia through the Shia groups in Yemen.&nbsp;</div><br><div class='image-container w3-center'><img src='https://preview.redd.it/95q5mky7ntu41.jpg?auto=webp&amp;s=7a2eff1f3421b6e94a8aad8753b3b5a3453f1ca1' width='50%'><div class='image-overlay'>Reference: https://preview.redd.it</div></div><div><br></div><div>Saudi Arabia is investing in its ports on the East borders. Because the Red Sea is a common route for Western and Eastern countries' ships. So, it can be very profitable. Although Saudi Arabia has access to the oceans from the West and East, there are three choke points that can be controlled by rivals of this country, such as Iran and Egypt. That's why Saudi Arabia has to rely on the World marine superpower (U.S.) to secure its ships. With the improvements in energy, the U.S. has become less dependent on Saudi Arabia's oil. So, Saudi Arabia may not be able to offer anything to the U.S. in the future for collaboration. That's why Mohammed Bin Salman purchased lots of weapons from western countries. But, they have a lack of military expertise and they are still dependent on the West. Lack of military expertise is also the reason why Saudi Arabia uses proxies in its conflicts with Iran, to keep the war far from its borders.</div></div><div><iframe width='100%' height='300' src='https://www.youtube.com/embed/RTkGng3YcOs?controls=0' title='YouTube video player' frameborder='0' allow='accelerometer; autoplay; clipboard-write; encrypted-media; gyroscope; picture-in-picture' allowfullscreen></iframe><br></div>"
